{"$defs":{"contentHash":{"pattern":"^sha256:[0-9a-f]{64}$","type":"string"},"contractReference":{"additionalProperties":false,"properties":{"component_contract_id":{"pattern":"^schuss-component-contract-[0-9]{6}$","type":"string"},"content_hash":{"$ref":"#/$defs/contentHash"},"revision":{"minimum":1,"type":"integer"}},"required":["component_contract_id","revision","content_hash"],"type":"object"},"implementationReference":{"additionalProperties":false,"properties":{"content_hash":{"$ref":"#/$defs/contentHash"},"implementation_id":{"pattern":"^schuss-implementation-[0-9]{6}$","type":"string"},"revision":{"minimum":1,"type":"integer"}},"required":["implementation_id","revision","content_hash"],"type":"object"},"rawSha256":{"pattern":"^[0-9a-f]{64}$","type":"string"},"sourceAuthority":{"additionalProperties":false,"properties":{"byte_sha256":{"$ref":"#/$defs/rawSha256"},"commit":{"pattern":"^[0-9a-f]{40}$","type":"string"},"license_declaration":{"minLength":1,"type":"string"},"portable_path":{"pattern":"^[A-Za-z0-9][A-Za-z0-9._ -]*(?:/[A-Za-z0-9][A-Za-z0-9._ -]*)*$","type":"string"},"source_id":{"enum":["axoloti-factory","axoloti-contrib","patcher","schuss"]}},"required":["source_id","commit","portable_path","byte_sha256","license_declaration"],"type":"object"}},"$id":"direct-operation-spec-v1.schema.json","$schema":"https://json-schema.org/draft/2020-12/schema","additionalProperties":false,"properties":{"canonical_profile":{"const":"schuss-canonical-json-v1"},"compatibility_mode":{"const":"legacy-equivalent-task025-v1"},"content_hash":{"$ref":"#/$defs/contentHash"},"contract_reference":{"$ref":"#/$defs/contractReference"},"direct_operation_spec_id":{"pattern":"^schuss-direct-operation-spec-[0-9]{6}$","type":"string"},"golden_vector_set":{"additionalProperties":false,"properties":{"byte_sha256":{"$ref":"#/$defs/rawSha256"},"portable_path":{"const":"evidence/task025-completion-v1/semantic-goldens.json"},"schema_version":{"const":"task025-semantic-goldens-v1"},"section":{"minLength":1,"type":"string"}},"required":["schema_version","portable_path","section","byte_sha256"],"type":"object"},"numeric_semantics":{"items":{"minLength":1,"type":"string"},"minItems":1,"type":"array","x-schuss-array-kind":"sequence"},"opcode":{"enum":["blep-saw-q27","blep-pwm-q27","exponential-smooth-q27","soft-clip-q27","interpolated-vca-q27"]},"revision":{"minimum":1,"type":"integer"},"runtime_dependencies":{"items":{"minLength":1,"type":"string"},"type":"array","uniqueItems":true,"x-schuss-array-kind":"set"},"schedule_semantics":{"items":{"minLength":1,"type":"string"},"minItems":1,"type":"array","x-schuss-array-kind":"sequence"},"schema_version":{"const":"direct-operation-spec-v1"},"source_authority":{"items":{"$ref":"#/$defs/sourceAuthority"},"minItems":1,"type":"array","uniqueItems":true,"x-schuss-array-kind":"set"},"source_binding_reference":{"$ref":"#/$defs/implementationReference"},"state_semantics":{"items":{"minLength":1,"type":"string"},"minItems":1,"type":"array","x-schuss-array-kind":"sequence"}},"required":["schema_version","canonical_profile","direct_operation_spec_id","revision","content_hash","opcode","compatibility_mode","contract_reference","source_binding_reference","source_authority","runtime_dependencies","numeric_semantics","state_semantics","schedule_semantics","golden_vector_set"],"title":"Schuss exact Task 025 direct operation specification v1","type":"object"}
