{"canonical_profile":"schuss-canonical-json-v1","compatibility_mode":"legacy-equivalent-task025-v1","content_hash":"sha256:3204f90221c98bf89216294721c71f332391a3632801dec1e9c055ec27dbb922","contract_reference":{"component_contract_id":"schuss-component-contract-000015","content_hash":"sha256:705b8e11c00d985eb8fd010a2d3fd71cb891f00711ad647b0746cdfb90c6ff81","revision":1},"direct_operation_spec_id":"schuss-direct-operation-spec-000010","golden_vector_set":{"byte_sha256":"7a0ec21f952175362986ada0c73534e45c19a860c4aae6eec431e34296c93873","portable_path":"evidence/task025-completion-v1/semantic-goldens.json","schema_version":"task025-semantic-goldens-v1","section":"operations.exponential-smooth-q27"},"numeric_semantics":["formula=\"___SMMLA(value-input,(-1<<26)+(time>>1),value)\"","multiply=\"signed-high-word-plus-wrapping-accumulator\""],"opcode":"exponential-smooth-q27","revision":1,"runtime_dependencies":["arm-fixed-point-runtime"],"schedule_semantics":["rate=\"one-control-update-per-block\"","authoring_transfer=\"unresolved-outside-fixed-graph-value\""],"schema_version":"direct-operation-spec-v1","source_authority":[{"byte_sha256":"f4c2bfbfc6f9748393bfe62af39e095ca184f9a5cc0ada21414b22a396e73fb0","commit":"25d2615ed5233546d617017666a4ab1e60a8c506","license_declaration":"BSD","portable_path":"objects/math/smooth.axo","source_id":"axoloti-factory"},{"byte_sha256":"95ccbdbea15078a6ef207e87749bb8defaa4662b6eebddfb40944f350b549191","commit":"08d3e6e1e2b61230308c20a15ded58ffdaf4656c","license_declaration":"GPL-3.0-or-later","portable_path":"firmware/axoloti_math.h","source_id":"patcher"}],"source_binding_reference":{"content_hash":"sha256:02f237a82ee92f47c5b6676ea1819b942728fe873cedd47a124fc32b74dca81b","implementation_id":"schuss-implementation-000054","revision":2},"state_semantics":["value=\"explicit-zero-initialization\""]}
