{"canonical_profile":"schuss-canonical-json-v1","compatibility_mode":"legacy-equivalent-task025-v1","content_hash":"sha256:d94c958f4f0a4cb0d9a720972ea8929ad01c5487c8b2795d5ec441bd294c993a","contract_reference":{"component_contract_id":"schuss-component-contract-000020","content_hash":"sha256:0cf9737582327560e82feb565fd3092993b750938a9669fc43305b5658ac5490","revision":1},"direct_operation_spec_id":"schuss-direct-operation-spec-000013","golden_vector_set":{"byte_sha256":"7a0ec21f952175362986ada0c73534e45c19a860c4aae6eec431e34296c93873","portable_path":"evidence/task025-completion-v1/semantic-goldens.json","schema_version":"task025-semantic-goldens-v1","section":"operations.interpolated-vca-q27"},"numeric_semantics":["step=\"arithmetic-shift-right-4-of-gain-minus-previous\"","sample=\"___SMMUL(audio,interpolated-gain)<<5\"","remainder=\"discarded-after-sixteen-samples\""],"opcode":"interpolated-vca-q27","revision":1,"runtime_dependencies":["arm-fixed-point-runtime"],"schedule_semantics":["rate=\"one-control-step-plus-sixteen-audio-samples\""],"schema_version":"direct-operation-spec-v1","source_authority":[{"byte_sha256":"0fc7ff51ec5ca878375540cb7764651884a2286ff7699ed05c6a103b565cb3b7","commit":"25d2615ed5233546d617017666a4ab1e60a8c506","license_declaration":"BSD","portable_path":"objects/gain/vca.axo","source_id":"axoloti-factory"},{"byte_sha256":"95ccbdbea15078a6ef207e87749bb8defaa4662b6eebddfb40944f350b549191","commit":"08d3e6e1e2b61230308c20a15ded58ffdaf4656c","license_declaration":"GPL-3.0-or-later","portable_path":"firmware/axoloti_math.h","source_id":"patcher"}],"source_binding_reference":{"content_hash":"sha256:d24e2ea5d72ca43be901fe161cbc89d05a9f6592ea89d38b8bf9a25e2c91bff1","implementation_id":"schuss-implementation-000059","revision":2},"state_semantics":["previous_gain=\"static-storage-zero-initialization\"","previous_gain_update=\"before-audio-loop-after-local-copy\""]}
